{
  "schema": "aftergraph-component/1.0",
  "identity": {"product": "sentinel", "component": "sentinel-engine"},
  "release": {"version": "1.4.0", "lifecycle": "preview"},
  "platform": {"generation": 26, "release_train": "2026.09"},
  "compatibility": {
    "level": "APC-1",
    "profiles": ["verifier"],
    "minimum": "APC-1",
    "tested_against": "APC-1"
  },
  "contracts": {"correlation": "1.0", "evidence": "1.1", "verdict": "1.0"},
  "provenance": {
    "repository": "Aftergraph/sentinel",
    "commit": "1111111111111111111111111111111111111111"
  }
}
